station_id,name,operator,network,lat,lon,source,connector_summary,power_summary,opening_hours,verification_status,notes
ry_pea_volta_pluakdaeng_seed,PEA VOLTA Pluak Daeng audit target,PEA,PEA VOLTA,13.0275,101.2105,PEA VOLTA app / field audit needed,unknown,unknown,unknown,operator_app_verification_needed,"Check Pluak Daeng-side public PEA VOLTA presence, port mix, and public access."
ry_elexa_amata_rayong_seed,EleXA Amata Rayong audit target,EGAT / PT,EleXA,13.0705,101.0675,EleXA app / field audit needed,unknown,unknown,unknown,operator_app_verification_needed,"Potential competitor around Amata City Rayong; exact pin and kW still need operator-app confirmation."
ry_ptt_nittaya_grand_petroleum_kmz,PTT Nittaya Grand Petroleum,PTT,EV Station PluZ,13.00083,101.1308,C:\Users\Lenovo\Downloads\DC EV Charging Station Thailand - Piyamate Wisanuvej.kmz,CCS2,"Public PTT EV station from KMZ; exact gun count and kW to confirm in operator app",unknown,public_listing_needs_operator_verification,"Named public charger in Map Yang Phon / Pluak Daeng from KMZ; strategically relevant to the Siam Eastern and industrial-estate corridor."
ry_ptt_in_oil_2016_kmz,PTT In Oil 2016,PTT,EV Station PluZ,12.99996,101.2032,C:\Users\Lenovo\Downloads\DC EV Charging Station Thailand - Piyamate Wisanuvej.kmz,CCS2,"Public PTT EV station from KMZ; exact gun count and kW to confirm in operator app",unknown,public_listing_needs_operator_verification,"Named public charger in central Pluak Daeng from KMZ; useful for town-core and estate-worker competition coverage."
ry_robinson_lifestyle_ban_chang_kmz,Robinson Lifestyle Ban Chang,PTT,EV Station PluZ,12.73865,101.081,C:\Users\Lenovo\Downloads\DC EV Charging Station Thailand - Piyamate Wisanuvej.kmz,"CCS2, Type 2","Public PTT EV station from KMZ; exact gun count and kW to confirm in operator app",unknown,public_listing_needs_operator_verification,"Named charger at Robinson Lifestyle Ban Chang from KMZ; relevant for coastal Rayong and U-Tapao-side retail competition."
ry_ptt_rayong_gas_separation_plant_kmz,PTT Rayong Gas Separation Plant,PTT,EV Station PluZ,12.72254,101.1519,C:\Users\Lenovo\Downloads\DC EV Charging Station Thailand - Piyamate Wisanuvej.kmz,"CCS2, Type 2","Public PTT EV station from KMZ; exact gun count and kW to confirm in operator app",unknown,public_listing_needs_operator_verification,"Named Map Ta Phut-side public charger from KMZ; useful for industrial and Sukhumvit coastal corridor competition."
