station_id,name,operator,network,lat,lon,area,source,source_url,connector_summary,power_summary,opening_hours,verification_status,competition_relevance,notes,guns,max_kw
ptt_charging_station_phitsanulok,PTT Charging Station (Wat Chan),PTTOR,EV Station PluZ,16.8044707,100.2449184,Wat Chan / east-inner-city,SpotMyCharge,https://www.spotmycharge.com/charging-station/ptt-charging-station-phitsanulok,"Public PTT/EV station; exact connector mix to confirm in operator app","Conservative modeling assumption: 1 DC gun at 60 kW pending operator-app audit",24 hours,public_listing_needs_operator_verification,high_for_city_core,"Named inner-city PTT station from SpotMyCharge. Coordinates are set from the published Wat Chan address and should be good enough for city-core screening.",1,60
ptt_charging_station_phitsanulok_1,PTT Charging Station - Phitsanulok-1,PTTOR,EV Station PluZ,16.8183375,100.3187969,Samo Khae / bypass east / Terminal 2,SpotMyCharge,https://www.spotmycharge.com/charging-station/ptt-charging-station-phitsanulok-1,"Public PTT/EV station; exact connector mix to confirm in operator app","Conservative modeling assumption: 1 DC gun at 60 kW pending operator-app audit",24 hours,public_listing_needs_operator_verification,high_for_bypass_gateway,"Named PTT station on the Samo Khae side from SpotMyCharge. Coordinates are decoded from the published plus code and are intended for bypass-corridor competition screening.",1,60
ptt_charging_station_phitsanulok_2,PTT Charging Station - Phitsanulok-2,PTTOR,EV Station PluZ,16.8697625,100.2093594,Ban Krang / Singhawat northwest ring,SpotMyCharge,https://www.spotmycharge.com/charging-station/ptt-charging-station-phitsanulok-2,"Public PTT/EV station; exact connector mix to confirm in operator app","Conservative modeling assumption: 1 DC gun at 60 kW pending operator-app audit",24 hours,public_listing_needs_operator_verification,medium_high_for_city_northwest,"Named PTT station on Singhawat Road in the Ban Krang catchment from SpotMyCharge. Coordinates are decoded from the published plus code.",1,60
ptt_charging_station_phitsanulok_3,PTT Charging Station - Phitsanulok-3,PTTOR,EV Station PluZ,16.8283375,100.4145781,Wang Thong / Route 12 east gateway,SpotMyCharge,https://www.spotmycharge.com/charging-station/ptt-charging-station-phitsanulok-3,"Public PTT/EV station; exact connector mix to confirm in operator app","Conservative modeling assumption: 1 DC gun at 60 kW pending operator-app audit",24 hours,public_listing_needs_operator_verification,high_for_wang_thong_gateway,"Named PTT station in Wang Thong from SpotMyCharge. Coordinates are decoded from the published plus code and provide an east-gateway competitor for Route 12 screening.",1,60
sharge_phitsanulok,SHARGE Charging Station,SHARGE,SHARGE,16.8260875,100.2686719,Old city / Phaya Suea / Nai Mueang,SpotMyCharge,https://www.spotmycharge.com/charging-station/sharge-charging-station-phitsanulok,"Public charging station; exact connector mix to confirm in operator app","Conservative modeling assumption: 1 DC-equivalent gun at 50 kW pending operator-app audit",24 hours,public_listing_needs_operator_verification,high_for_old_city_core,"Named SHARGE station on Phaya Suea Road from SpotMyCharge. Coordinates are decoded from the published plus code and strengthen old-city competition coverage.",1,50
