station_id,name,operator,network,lat,lon,google_maps_evidence,connector_summary,power_summary,opening_hours,verification_status,notes
pea_volta_ubon_2,PEA VOLTA Ubon Ratchathani #2,PEA,PEA VOLTA,,,TripNiceDay listing at 195 Moo 7 Lieng Muang Road Chae Ramae Mueang Ubon Ratchathani,unknown,unknown,unknown,public_listing_needs_operator_verification,"Public listing says station is fully installed; verify exact pin, live status, connector count, kW, and 24h access in PEA VOLTA app."
pea_volta_ubon_1,PEA VOLTA Ubon Ratchathani #1,PEA,PEA VOLTA,,,TripNiceDay nearby-place reference; Electromaps result says listing may be unavailable,unknown,unknown,unknown,public_listing_conflicting,"Needs operator-app verification because public listings conflict on availability."
ptt_charging_ubon_ring_road,PTT / EV Station PluZ Ubon ring-road candidate,OR/PTT,EV Station PluZ,,,SpotMyCharge lists PTT Charging Station around Chae Ramae ring road,unknown,unknown,unknown,public_listing_needs_operator_verification,"Likely meaningful DC competition around ring road; verify exact pins, guns, kW, and live app status."
ptt_charging_ubon_warin_1,PTT Charging Station Ubon Ratchathani-1,OR/PTT,EV Station PluZ,,,SpotMyCharge listing in Nong Kin Phen / Warin Chamrap area,unknown,unknown,unknown,public_listing_needs_operator_verification,"Potential south-city/Warin competitor."
ptt_charging_ubon_warin_2,PTT Charging Station Ubon Ratchathani-2,OR/PTT,EV Station PluZ,,,SpotMyCharge listing in Warin Chamrap / Saen Suk area,unknown,unknown,unknown,public_listing_needs_operator_verification,"Potential Route 24/Warin competitor."
ea_anywhere_ubon_square,EA Anywhere Ubon Square candidate,EA Anywhere,EA Anywhere,,,SpotMyCharge listing at Ubon Square area,unknown,unknown,unknown,public_listing_needs_operator_verification,"Urban destination competitor; verify whether active and public."
elexa_sirindhorn_chong_mek,EleXA Sirindhorn / Chong Mek axis candidate,EGAT,EleXA,,,SpotMyCharge listing in Nikhom Lamdom Noi / Sirindhorn area,unknown,unknown,unknown,public_listing_needs_operator_verification,"Potential border/tourism corridor competitor near Sirindhorn-Chong Mek axis."
