station_id,name,operator,network,lat,lon,source,connector_summary,power_summary,opening_hours,verification_status,notes
ev_station_pluz_bangpu_seed,EV Station PluZ Bang Pu audit target,OR,EV Station PluZ,,,,EV Station PluZ app / field audit needed,unknown,unknown,unknown,operator_app_verification_needed,"Audit OR/PTT charging points on Sukhumvit Road and the Bang Pu industrial corridor before treating competition as confirmed."
pea_volta_samut_prakan_seed,PEA VOLTA Samut Prakan east audit target,PEA,PEA VOLTA,,,,PEA VOLTA app / field audit needed,unknown,unknown,unknown,operator_app_verification_needed,"Check east Samut Prakan and Bang Pu-side PEA VOLTA presence, port mix, and public access."
elexa_samut_prakan_seed,EleXA Samut Prakan east audit target,EGAT / PT,EleXA,,,,EleXA app / field audit needed,unknown,unknown,unknown,operator_app_verification_needed,"Potential PT-station competitor on the Bang Pu corridor; exact pins and kW still need confirmation."
mg_super_charge_samut_prakan_seed,MG Super Charge Samut Prakan audit target,MG,MG Super Charge,,,,MG app / dealer map needed,unknown,unknown,unknown,operator_app_verification_needed,"Check MG dealer and public charger presence on the Samut Prakan-Bang Pu side before converting into a live competitor signal."
sp_ptt_lertthitinan_petroleum_kmz,PTT Lertthitinan Petroleum,PTT,EV Station PluZ,13.505451,100.73488,C:\Users\Lenovo\Downloads\DC EV Charging Station Thailand - Piyamate Wisanuvej.kmz,CCS2,"Public PTT EV station from KMZ; exact gun count and kW to confirm in operator app",unknown,public_listing_needs_operator_verification,"Named Bang Pu-side public charger from KMZ; directly relevant to Bang Pu industrial and coastal competition."
sp_robinson_lifestyle_samut_prakan_kmz,Robinson Lifestyle Samut Prakan,PTT,EV Station PluZ,13.5845109145,100.6088208541,C:\Users\Lenovo\Downloads\DC EV Charging Station Thailand - Piyamate Wisanuvej.kmz,"CCS2, Type 2","Public PTT EV station from KMZ; exact gun count and kW to confirm in operator app",unknown,public_listing_needs_operator_verification,"Named charger at Robinson Lifestyle Samut Prakan from KMZ; strong lifestyle-retail competitor on the urban commuter band."
sp_bigc_samut_prakan_kmz,BigC Samut Prakan,PTT,EV Station PluZ,13.58444,100.6072,C:\Users\Lenovo\Downloads\DC EV Charging Station Thailand - Piyamate Wisanuvej.kmz,"CCS2, Type 2","Public PTT EV station from KMZ; exact gun count and kW to confirm in operator app",unknown,public_listing_needs_operator_verification,"Named charger at BigC Samut Prakan from KMZ; reinforces competition in the same urban-retail cluster."
sp_ptt_jiang_asawan_phraekkasa_kmz,PTT Jiang-Asawan Nongkhai (Phraekkasa),PTT,EV Station PluZ,13.566833,100.663228,C:\Users\Lenovo\Downloads\DC EV Charging Station Thailand - Piyamate Wisanuvej.kmz,CCS2,"Public PTT EV station from KMZ; exact gun count and kW to confirm in operator app",unknown,public_listing_needs_operator_verification,"Named charger on Phraekkasa Road from KMZ; useful for eastern Samut Prakan residential-industrial competition coverage."
