name_th,name_en,provider,network_suggested,connector_summary,address,province_th,lat,lon,style,source_url
PT นครปฐม 9,,EleX,EleX,2x CCS2 150 kW,"80,80/8 หมู่ที่8 ตำบลลำพยา อำเภอเมืองนครปฐม จังหวัดนครปฐม 73000",จังหวัดนครปฐม,13.802663,100.005685,#icon-ci-5-labelson,C:\Users\Lenovo\Downloads\DC EV Charging Station Thailand - Piyamate Wisanuvej.kmz
PT จันทบุรี,,EleX,EleX,2x CCS2 150 kW,จันทบุรี,จันทบุรี,12.771828,101.841932,#icon-ci-5-labelson,C:\Users\Lenovo\Downloads\DC EV Charging Station Thailand - Piyamate Wisanuvej.kmz
PT พนัสนิคม 7,,EleX,EleX,2x CCS2 150 kW,98 หมู่ที่8 ตำบลหนองปรือ อำเภอพนัสนิคม จังหวัดชลบุรี 20140,จังหวัดชลบุรี,13.522024,101.266462,#icon-ci-5-labelson,C:\Users\Lenovo\Downloads\DC EV Charging Station Thailand - Piyamate Wisanuvej.kmz
PT งาว,,EleX,EleX,2x CCS2 150 kW,ลำปาง,ลำปาง,18.740683,99.974414,#icon-ci-5-labelson,C:\Users\Lenovo\Downloads\DC EV Charging Station Thailand - Piyamate Wisanuvej.kmz
PT เมืองเพชรบูรณ์ 1,,EleX,EleX,2x CCS2 150 kW,เพชรบูรณ์,เพชรบูรณ์,16.531802,101.15695,#icon-ci-5-labelson,C:\Users\Lenovo\Downloads\DC EV Charging Station Thailand - Piyamate Wisanuvej.kmz
PT มโนรมย์ 2,,EleX,EleX,2x CCS2 150 kW,ชัยนาท,ชัยนาท,15.270968,100.19792,#icon-ci-5-labelson,C:\Users\Lenovo\Downloads\DC EV Charging Station Thailand - Piyamate Wisanuvej.kmz
PT บ้านค่าย 5,,EleX,EleX,2x CCS2 150 kW,ระยอง,ระยอง,12.867484,101.314558,#icon-ci-5-labelson,C:\Users\Lenovo\Downloads\DC EV Charging Station Thailand - Piyamate Wisanuvej.kmz
PT วชิรบารมี 1,,EleX,EleX,2x CCS2 150 kW,พิจิตร,พิจิตร,16.480321,100.147689,#icon-ci-5-labelson,C:\Users\Lenovo\Downloads\DC EV Charging Station Thailand - Piyamate Wisanuvej.kmz
PT วัฒนานคร3,,EleX,EleX,2x CCS2 150 kW,สระแก้ว,สระแก้ว,13.776767,102.205807,#icon-ci-5-labelson,C:\Users\Lenovo\Downloads\DC EV Charging Station Thailand - Piyamate Wisanuvej.kmz
PT พรหมบุรี 2,,EleX,EleX,2x CCS2 150 kW,สิงห์บุรี,สิงห์บุรี,14.846623,100.446469,#icon-ci-5-labelson,C:\Users\Lenovo\Downloads\DC EV Charging Station Thailand - Piyamate Wisanuvej.kmz
Outdoor Kingbridge (Outdoor),,EleX,EleX,2x CCS2 60 kW,"Rama 3 Rd, Bang Phong Phang, Yan Nawa, Bangkok 10120",Bangkok,13.675136,100.539561,#icon-ci-5-labelson,C:\Users\Lenovo\Downloads\DC EV Charging Station Thailand - Piyamate Wisanuvej.kmz
PT หนองกี่,,EleX,EleX,2x CCS2 150 kW,บุรีรัมย์,บุรีรัมย์,14.685431,102.533386,#icon-ci-5-labelson,C:\Users\Lenovo\Downloads\DC EV Charging Station Thailand - Piyamate Wisanuvej.kmz
PT ปราสาท 6,,EleX,EleX,2x CCS2 150 kW,สุรินทร์,สุรินทร์,14.624384,103.383028,#icon-ci-5-labelson,C:\Users\Lenovo\Downloads\DC EV Charging Station Thailand - Piyamate Wisanuvej.kmz
PT สว่างวีระวงศ์,,EleX,EleX,2x CCS2 150 kW,อุบลราชธานี,อุบลราชธานี,15.229888,104.977426,#icon-ci-5-labelson,C:\Users\Lenovo\Downloads\DC EV Charging Station Thailand - Piyamate Wisanuvej.kmz
PT คลอง 4 (ธัญบุรี),,EleX,EleX,2x CCS2 150 kW,ปทุมธานี,ปทุมธานี,13.998144,100.686217,#icon-ci-5-labelson,C:\Users\Lenovo\Downloads\DC EV Charging Station Thailand - Piyamate Wisanuvej.kmz
PT นครหลวง 4,,EleX,EleX,2x CCS2 150 kW,พระนครศรีอยุธยา,พระนครศรีอยุธยา,14.40658,100.583635,#icon-ci-5-labelson,C:\Users\Lenovo\Downloads\DC EV Charging Station Thailand - Piyamate Wisanuvej.kmz
PT บ้านโพธิ์ 3,,EleX,EleX,2x CCS2 150 kW,ฉะเชิงเทรา,ฉะเชิงเทรา,13.602474,101.094906,#icon-ci-5-labelson,C:\Users\Lenovo\Downloads\DC EV Charging Station Thailand - Piyamate Wisanuvej.kmz
PT ประตูน้ำพระอินทร์ 1,,EleX,EleX,2x CCS2 150 kW,"Chiang Rak Noi, Bang Pa-in District, Chang Wat Phra Nakhon Si Ayutthaya 12120",Ayutthaya,14.139923,100.617648,#icon-ci-5-labelson,C:\Users\Lenovo\Downloads\DC EV Charging Station Thailand - Piyamate Wisanuvej.kmz
PT บางปะกง,,EleX,EleX,2x CCS2 150 kW,ฉะเชิงเทรา,ฉะเชิงเทรา,13.552976,100.956908,#icon-ci-5-labelson,C:\Users\Lenovo\Downloads\DC EV Charging Station Thailand - Piyamate Wisanuvej.kmz
PT ปราณบุรี 2,,EleX,EleX,2x CCS2 150 kW,ประจวบคีรีขันธ์,ประจวบคีรีขันธ์,12.370164,99.886638,#icon-ci-5-labelson,C:\Users\Lenovo\Downloads\DC EV Charging Station Thailand - Piyamate Wisanuvej.kmz
PT กบินทร์บุรี 9,,EleX,EleX,2x CCS2 150 kW,ปราจีนบุรี,ปราจีนบุรี,13.97636,101.746022,#icon-ci-5-labelson,C:\Users\Lenovo\Downloads\DC EV Charging Station Thailand - Piyamate Wisanuvej.kmz
BPTG กำแพงเพชร,,EleX,EleX,2x CCS2 150 kW,กำแพงเพชร,กำแพงเพชร,16.400701,99.520785,#icon-ci-5-labelson,C:\Users\Lenovo\Downloads\DC EV Charging Station Thailand - Piyamate Wisanuvej.kmz
PT สามร้อยยอด 1,,EleX,EleX,2x CCS2 150 kW,ประจวบคีรีขันธ์,ประจวบคีรีขันธ์,12.322943,99.878387,#icon-ci-5-labelson,C:\Users\Lenovo\Downloads\DC EV Charging Station Thailand - Piyamate Wisanuvej.kmz
PT ห้างฉัตร 2,,EleX,EleX,2x CCS2 150 kW,ลำปาง,ลำปาง,18.314185,99.383522,#icon-ci-5-labelson,C:\Users\Lenovo\Downloads\DC EV Charging Station Thailand - Piyamate Wisanuvej.kmz
PT เชียงราย 7,,EleX,EleX,2x CCS2 150 kW,เชียงราย,เชียงราย,19.87163,99.82712,#icon-ci-5-labelson,C:\Users\Lenovo\Downloads\DC EV Charging Station Thailand - Piyamate Wisanuvej.kmz
PT ถ.พระราม 2 กม.53,,EleX,EleX,2x CCS2 150 kW,สมุทรสาคร,สมุทรสาคร,13.453161,100.08404,#icon-ci-5-labelson,C:\Users\Lenovo\Downloads\DC EV Charging Station Thailand - Piyamate Wisanuvej.kmz
PT ลำลูกกา 8,,EleX,EleX,2x CCS2 150 kW,ลำลูกกา,ลำลูกกา,13.950139,100.809213,#icon-ci-5-labelson,C:\Users\Lenovo\Downloads\DC EV Charging Station Thailand - Piyamate Wisanuvej.kmz
PT พุทธมณฑลสาย 4,,EleX,EleX,2x CCS2 150 kW,นครปฐม,นครปฐม,13.73186,100.33013,#icon-ci-5-labelson,C:\Users\Lenovo\Downloads\DC EV Charging Station Thailand - Piyamate Wisanuvej.kmz
PT ทุ่งตะโก 1,,EleX,EleX,2x CCS2 150 kW,ชุมพร,ชุมพร,10.131111,99.091907,#icon-ci-5-labelson,C:\Users\Lenovo\Downloads\DC EV Charging Station Thailand - Piyamate Wisanuvej.kmz
BPTG ตาก,,EleX,EleX,2x CCS2 150 kW,ตาก,ตาก,16.819815,99.130917,#icon-ci-5-labelson,C:\Users\Lenovo\Downloads\DC EV Charging Station Thailand - Piyamate Wisanuvej.kmz
PT ท่ามะกา 3,,EleX,EleX,2x CCS2 150 kW,กาญจนบุรี,กาญจนบุรี,13.912292,99.770504,#icon-ci-5-labelson,C:\Users\Lenovo\Downloads\DC EV Charging Station Thailand - Piyamate Wisanuvej.kmz
PT นครราชสีมา 12,,EleX,EleX,2x CCS2 150 kW,นครราชสีมา,นครราชสีมา,14.951527,102.123186,#icon-ci-5-labelson,C:\Users\Lenovo\Downloads\DC EV Charging Station Thailand - Piyamate Wisanuvej.kmz
PT บ้านตาก 1,,EleX,EleX,2x CCS2 150 kW,ตาก,ตาก,17.028556,99.092586,#icon-ci-5-labelson,C:\Users\Lenovo\Downloads\DC EV Charging Station Thailand - Piyamate Wisanuvej.kmz
PT ละแม 3,,EleX,EleX,2x CCS2 150 kW,ชุมพร,ชุมพร,9.790658,99.075431,#icon-ci-5-labelson,C:\Users\Lenovo\Downloads\DC EV Charging Station Thailand - Piyamate Wisanuvej.kmz
PT บางละมุง 11,,EleX,EleX,2x CCS2 150 kW,"Laem Chabang, Bang Lamung District, Chon Buri",Buri,13.0392,100.92708,#icon-ci-5-labelson,C:\Users\Lenovo\Downloads\DC EV Charging Station Thailand - Piyamate Wisanuvej.kmz
PT วังน้อย3 (ถ.พหลโยธิน กม.52),,EleX,EleX,2x CCS2 150 kW,พระนครศรีอยุธยา,พระนครศรีอยุธยา,14.204697,100.662497,#icon-ci-5-labelson,C:\Users\Lenovo\Downloads\DC EV Charging Station Thailand - Piyamate Wisanuvej.kmz
PT กบินทร์บุรี 7,,EleX,EleX,2x CCS2 150 kW,ปราจีนบุรี,ปราจีนบุรี,14.055035,101.794345,#icon-ci-5-labelson,C:\Users\Lenovo\Downloads\DC EV Charging Station Thailand - Piyamate Wisanuvej.kmz
PT ถ.พระราม 2 กม.26,,EleX,EleX,2x CCS2 150 kW,สมุทรสาคร,สมุทรสาคร,13.568406,100.283839,#icon-ci-5-labelson,C:\Users\Lenovo\Downloads\DC EV Charging Station Thailand - Piyamate Wisanuvej.kmz
PT สมุทรสงคราม 4,,EleX,EleX,2x CCS2 150 kW,สมุทรสงคราม,สมุทรสงคราม,13.440161,100.064788,#icon-ci-5-labelson,C:\Users\Lenovo\Downloads\DC EV Charging Station Thailand - Piyamate Wisanuvej.kmz
PT พัฒนานิคม 2,,EleX,EleX,2x CCS2 150 kW,44/4 หมู่ 9 ช่องศรีกา อําเภอฟัตถานานิคร ลพบุรี 15220,ลพบุรี,14.8054,100.91162,#icon-ci-5-labelson,C:\Users\Lenovo\Downloads\DC EV Charging Station Thailand - Piyamate Wisanuvej.kmz
PT ปากช่อง 5,,EleX,EleX,2x CCS2 150 kW,นครราชสีมา,นครราชสีมา,14.666417,101.426737,#icon-ci-5-labelson,C:\Users\Lenovo\Downloads\DC EV Charging Station Thailand - Piyamate Wisanuvej.kmz
PT กำแพงเพชร 2,,EleX,EleX,2x CCS2 150 kW,กำแพงเพชร,กำแพงเพชร,16.372996,99.546504,#icon-ci-5-labelson,C:\Users\Lenovo\Downloads\DC EV Charging Station Thailand - Piyamate Wisanuvej.kmz
PT บางบัวทอง 9,,EleX,EleX,2x CCS2 150 kW,นนทบุรี,นนทบุรี,13.943914,100.427761,#icon-ci-5-labelson,C:\Users\Lenovo\Downloads\DC EV Charging Station Thailand - Piyamate Wisanuvej.kmz
PT ลาดกระบัง 6,,EleX,EleX,2x CCS2 150 kW,กรุงเทพมหานคร,กรุงเทพมหานคร,13.722691,100.744053,#icon-ci-5-labelson,C:\Users\Lenovo\Downloads\DC EV Charging Station Thailand - Piyamate Wisanuvej.kmz
PT เชียงใหม่ 1,,EleX,EleX,2x CCS2 150 kW,เชียงใหม่,เชียงใหม่,18.73997,98.957658,#icon-ci-5-labelson,C:\Users\Lenovo\Downloads\DC EV Charging Station Thailand - Piyamate Wisanuvej.kmz
PT สามโคก 3,,EleX,EleX,2x CCS2 150 kW,ปทุมธานี,ปทุมธานี,14.109236,100.570252,#icon-ci-5-labelson,C:\Users\Lenovo\Downloads\DC EV Charging Station Thailand - Piyamate Wisanuvej.kmz
PT ถ.สุวินทวงศ์ (กม.28),,EleX,EleX,2x CCS2 150 kW,กรุงเทพมหานคร,กรุงเทพมหานคร,13.820113,100.740375,#icon-ci-5-labelson,C:\Users\Lenovo\Downloads\DC EV Charging Station Thailand - Piyamate Wisanuvej.kmz
PT หนองเรือ 4,,EleX,EleX,2x CCS2 150 kW,ขอนแก่น,ขอนแก่น,16.48471,102.55279,#icon-ci-5-labelson,C:\Users\Lenovo\Downloads\DC EV Charging Station Thailand - Piyamate Wisanuvej.kmz
PT ถ.กิ่งแก้ว 2,,EleX,EleX,2x CCS2 150 kW,สมุทรปราการ,สมุทรปราการ,13.657881,100.71747,#icon-ci-5-labelson,C:\Users\Lenovo\Downloads\DC EV Charging Station Thailand - Piyamate Wisanuvej.kmz
PT ประเวศ 4,,EleX,EleX,2x CCS2 150 kW,กรุงเทพมหานคร,กรุงเทพมหานคร,13.720856,100.683857,#icon-ci-5-labelson,C:\Users\Lenovo\Downloads\DC EV Charging Station Thailand - Piyamate Wisanuvej.kmz
สถานีลานจอดรถบัส กฟผ. แม่เมาะ,,EleX,EleX,2x CCS2 120 kW (200A),ลำปาง,ลำปาง,18.289017,99.724491,#icon-ci-5-labelson,C:\Users\Lenovo\Downloads\DC EV Charging Station Thailand - Piyamate Wisanuvej.kmz
PT พุทธมณฑลสาย3,,EleX,EleX,2x CCS2 150 kW,แขวงบางไผ่ เขตบางแค 10160,เขตบางแค,13.741936,100.364144,#icon-ci-5-labelson,C:\Users\Lenovo\Downloads\DC EV Charging Station Thailand - Piyamate Wisanuvej.kmz
PT หนองแขม,,EleX,EleX,2x CCS2 150 kW,กรุงเทพมหานคร,กรุงเทพมหานคร,13.704869,100.341029,#icon-ci-5-labelson,C:\Users\Lenovo\Downloads\DC EV Charging Station Thailand - Piyamate Wisanuvej.kmz
PT ถ.พุทธบูชา1,,EleX,EleX,2x CCS2 150 kW,แขวงบางมด เขตจอมทอง กรุงเทพมหานคร 10150,กรุงเทพมหานคร,13.674931,100.471092,#icon-ci-5-labelson,C:\Users\Lenovo\Downloads\DC EV Charging Station Thailand - Piyamate Wisanuvej.kmz
PT ถ.บางขุนเทียน-ชายทะเล 1,,EleX,EleX,2x CCS2 150 kW,แขวงท่าข้าม เขตบางขุนเทียน 10150,เขตบางขุนเทียน,13.63,100.43436,#icon-ci-5-labelson,C:\Users\Lenovo\Downloads\DC EV Charging Station Thailand - Piyamate Wisanuvej.kmz
PT ถ.แพรกษา,,EleX,EleX,2x CCS2 150 kW,ตำบลแพรกษา อำเภอเมืองสมุทรปราการ จังหวัดสมุทรปราการ 10280,จังหวัดสมุทรปราการ,13.56767,100.662621,#icon-ci-5-labelson,C:\Users\Lenovo\Downloads\DC EV Charging Station Thailand - Piyamate Wisanuvej.kmz
PT ถ.เทพารักษ์ 4,,EleX,EleX,2x CCS2 150 kW,สมุทรปราการ,สมุทรปราการ,13.633242,100.61713,#icon-ci-5-labelson,C:\Users\Lenovo\Downloads\DC EV Charging Station Thailand - Piyamate Wisanuvej.kmz
PT ถ.เจ้าคุณทหาร 3,,EleX,EleX,2x CCS2 150 kW,กรุงเทพมหานคร,กรุงเทพมหานคร,13.752305,100.782722,#icon-ci-5-labelson,C:\Users\Lenovo\Downloads\DC EV Charging Station Thailand - Piyamate Wisanuvej.kmz
PT บึงกุ่ม 3,,EleX,EleX,2x CCS2 150 kW,"ถนนนวมินทร์, แขวงคลองกุ่ม แขวงนวลจันทร์ เขตบึงกุ่ม กรุงเทพมหานคร 10230",กรุงเทพมหานคร,13.811658,100.650182,#icon-ci-5-labelson,C:\Users\Lenovo\Downloads\DC EV Charging Station Thailand - Piyamate Wisanuvej.kmz
PT ถ.สะพานนนทบุรี-บางบัวทอง (นวลฉวี),,EleX,EleX,2x CCS2 150 kW,นนทบุรี,นนทบุรี,13.942294,100.540785,#icon-ci-5-labelson,C:\Users\Lenovo\Downloads\DC EV Charging Station Thailand - Piyamate Wisanuvej.kmz
Zpell,,EleX,EleX,Type2 7 kW,"ตําบล ประชาธิปัตย์, 94","ประชาธิปัตย์,",13.989044,100.617744,#icon-ci-5-labelson,C:\Users\Lenovo\Downloads\DC EV Charging Station Thailand - Piyamate Wisanuvej.kmz
PT นครชัยศรี 11,,EleX,EleX,2x CCS2 150 kW,ตำบลขุนแก้ว อำเภอนครชัยศรี นครปฐม 73120,นครปฐม,13.80821,100.148158,#icon-ci-5-labelson,C:\Users\Lenovo\Downloads\DC EV Charging Station Thailand - Piyamate Wisanuvej.kmz
ERDI-CMU สถาบันฯ พลังงาน มช.,,EleX,EleX,"CCS2 50 kW, CHAdeMO 50 kW, Type2 22 kW",155 ม.2 ต.แม่เหียะ อ.เมือง จ.เชียงใหม่ 50100,จ.เชียงใหม่,18.757285,98.939909,#icon-ci-5-labelson,C:\Users\Lenovo\Downloads\DC EV Charging Station Thailand - Piyamate Wisanuvej.kmz
ChargeROD @Petchburi เพชรบุรี,,EleX,EleX,"CCS2 40 kW, CHAdeMO 40 kW",69 หมู่ที่ 3 ถนนเพชรเกษม ตำบลท่ายาง อำเภอท่ายาง จังหวัดเพชรบุรี 76130,จังหวัดเพชรบุรี,12.996078,99.907895,#icon-ci-5-labelson,C:\Users\Lenovo\Downloads\DC EV Charging Station Thailand - Piyamate Wisanuvej.kmz
SUPERFAST by PPWE Chaloem Phrakiat Korat,,EleX,EleX,2x CCS2 120 kW (200A),ตำบลหนองงูเหลือม อำเภอเฉลิมพระเกียรติ จ.นครราชสีมา,จ.นครราชสีมา,15.079479,102.22351,#icon-ci-5-labelson,C:\Users\Lenovo\Downloads\DC EV Charging Station Thailand - Piyamate Wisanuvej.kmz
SUPERFAST by UAC (EECi),,EleX,EleX,"CCS2 50 kW, CHAdeMO 50 kW, Type2 43 kW",ระยอง,ระยอง,12.991868,101.444981,#icon-ci-5-labelson,C:\Users\Lenovo\Downloads\DC EV Charging Station Thailand - Piyamate Wisanuvej.kmz
Kolaocare Xaymoungkon EV charging station,,EleX,EleX,2x CCS2 100 kW,"ຖະໜົນ 13 ເໜືອ, ບ້ານສີເກີດ, ເມືອງນາຊາຍທອງ",ເມືອງນາຊາຍທອງ,18.024511,102.547632,#icon-ci-5-labelson,C:\Users\Lenovo\Downloads\DC EV Charging Station Thailand - Piyamate Wisanuvej.kmz
ศูนย์การแพทย์กาญจนาภิเษก,,EleX,EleX,CCS2 30 kW,"888 Borommaratchachonnani Rd, Salaya, Phutthamonthon District, Nakhon Pathom 73170",Pathom,13.786948,100.321744,#icon-ci-5-labelson,C:\Users\Lenovo\Downloads\DC EV Charging Station Thailand - Piyamate Wisanuvej.kmz
SUPERFAST by PPWE Tha Mai,,EleX,EleX,2x CCS2 120 kW (200A),"89 5, Khao Wua, Tha Mai District, Chanthaburi 22120",Chanthaburi,12.657898,102.058864,#icon-ci-5-labelson,C:\Users\Lenovo\Downloads\DC EV Charging Station Thailand - Piyamate Wisanuvej.kmz
มหาวิทยาลัยราชภัฏเพชรบูรณ์,,EleX,EleX,2x CCS2 100 kW,83 หมู่ 11 ถนนสระบุรี-หล่มสัก ตำบลสะเดียง อำเภอเมือง จังหวัดเพชรบูรณ์ 67000,จังหวัดเพชรบูรณ์,16.451985,101.152862,#icon-ci-5-labelson,C:\Users\Lenovo\Downloads\DC EV Charging Station Thailand - Piyamate Wisanuvej.kmz
Chiangmai ram Health Center,,EleX,EleX,2x CCS2 50 kW,8 ถ.บุญเรืองฤทธิ์ ต.ศรีภูมิ อ.เมือง จ.เชียงใหม่ 50200,จ.เชียงใหม่,18.793019,98.977575,#icon-ci-5-labelson,C:\Users\Lenovo\Downloads\DC EV Charging Station Thailand - Piyamate Wisanuvej.kmz
SUPERFAST by PPWE Non Sung,,EleX,EleX,2x CCS2 120 kW (200A),ตำบลบิง อำเภอโนนสูง จ.นครราชสีมา,จ.นครราชสีมา,15.119312,102.300814,#icon-ci-5-labelson,C:\Users\Lenovo\Downloads\DC EV Charging Station Thailand - Piyamate Wisanuvej.kmz
UCIS EV1,,EleX,EleX,2x CCS2 120 kW (200A),272 หมู่ 2 ถนน ซุปเปอร์ไฮเวย์ เชียงใหม่-ลำปาง ตำบล หนองผึ้ง อำเภอ สารภี เชียงใหม่ 50140,เชียงใหม่,18.748526,99.034,#icon-ci-5-labelson,C:\Users\Lenovo\Downloads\DC EV Charging Station Thailand - Piyamate Wisanuvej.kmz
วิทยาลัยนานาชาติ อาคาร 1 มหาวิทยาลัยมหิดล,,EleX,EleX,CCS2 30 kW,999 ถ.พุทธมณฑลสาย 4 ต.ศาลายา อ.พุทธมณฑล จ.นครปฐม 73170,จ.นครปฐม,13.792993,100.326028,#icon-ci-5-labelson,C:\Users\Lenovo\Downloads\DC EV Charging Station Thailand - Piyamate Wisanuvej.kmz
EGCO Tower Station,,EleX,EleX,2x CCS2 60 kW,เลขที่ 222 ถนนวิภาวดีรังสิต แขวงทุ่งสองห้อง เขตหลักสี่ กรุงเทพฯ 10210,กรุงเทพฯ,13.870466,100.567973,#icon-ci-5-labelson,C:\Users\Lenovo\Downloads\DC EV Charging Station Thailand - Piyamate Wisanuvej.kmz
G2 Connect,,EleX,EleX,2x CCS2 120 kW (200A),โครงการ G2 Connect ถนนราชพฤกษ์ บางจาก เขตภาษีเจริญ กรุงเทพมหานคร,กรุงเทพมหานคร,13.729637,100.4517,#icon-ci-5-labelson,C:\Users\Lenovo\Downloads\DC EV Charging Station Thailand - Piyamate Wisanuvej.kmz
โลตัส ปิ่นเกล้า,Lotus’s Pinklao,Altervim,Altervim,"2x CCS2: 160 kW, Type2: 3 kW",3 ถนน บรมราชชนนี แขวง อรุณอมรินทร์ เขตบางกอกน้อย กรุงเทพมหานคร 10700,กรุงเทพมหานคร,13.7765410883112,100.47842964239,#icon-ci-6-labelson,C:\Users\Lenovo\Downloads\DC EV Charging Station Thailand - Piyamate Wisanuvej.kmz
โลตัส สุขาภิบาล 1,Lotus's Sukhapiban 1,Altervim,Altervim,"2x CCS2: 160 kW, Type2: 3 kW",629 799 ถนน นวมินทร์ แขวง นวลจันทร์ เขต บึงกุ่ม กรุงเทพมหานคร 10230,กรุงเทพมหานคร,13.8248563,100.6588743,#icon-ci-6-labelson,C:\Users\Lenovo\Downloads\DC EV Charging Station Thailand - Piyamate Wisanuvej.kmz
โลตัส บางนา-ตราด,Lotus's Bang Na-Trat,Altervim,Altervim,"4x CCS2: 160 kW, 2x Type2: 3 kW",14/9 หมู่ที่ 13 ถ. เทพรัตน ตำบล บางแก้ว อำเภอบางพลี สมุทรปราการ 10540,สมุทรปราการ,13.6528607,100.6781882,#icon-ci-6-labelson,C:\Users\Lenovo\Downloads\DC EV Charging Station Thailand - Piyamate Wisanuvej.kmz
โลตัส นอร์ธ ราชพฤกษ์,Lotus's North Ratchapruek,Altervim,Altervim,"4x CCS2: 150 kW (1000V 200A), 2x Type2: 3 kW","ถนนราชพฤกษ์, ตำบลอ้อมเกร็ด อำเภอปากเกร็ด นนทบุรี 11120",นนทบุรี,13.9125433074616,100.451431353182,#icon-ci-6-labelson,C:\Users\Lenovo\Downloads\DC EV Charging Station Thailand - Piyamate Wisanuvej.kmz
โลตัส อ่างทอง,Lotus's Ang Thong,Altervim,Altervim,"2x CCS2: 60 kW, Type2: 3 kW",เลขที่ 73 ถ.เลี่ยงเมือง ต.โพสะ อ.เมืองอ่างทอง จ.อ่างทอง 14000,จ.อ่างทอง,14.580418,100.460229,#icon-ci-6-labelson,C:\Users\Lenovo\Downloads\DC EV Charging Station Thailand - Piyamate Wisanuvej.kmz
โลตัส โรจนะ,Lotus's Rojana,Altervim,Altervim,"2x CCS2: 150 kW (1000V 200A), Type2: 3 kW",เลขที่ 101 ม. 3 ต.สามเรือน อ.บางปะอิน จ.พระนครศรีอยุธยา 13160,จ.พระนครศรีอยุธยา,14.3112110409337,100.6453425,#icon-ci-6-labelson,C:\Users\Lenovo\Downloads\DC EV Charging Station Thailand - Piyamate Wisanuvej.kmz
โลตัส บางปะอิน,Lotus Bang Pa-in,Altervim,Altervim,"2x CCS2: 150 kW (1000V 200A), Type2: 3 kW",88 ม.9 ต.เชียงรากน้อย อ.บางปะอิน จ.พระนครศรีอยุธยา 13180,จ.พระนครศรีอยุธยา,14.18873,100.60944,#icon-ci-6-labelson,C:\Users\Lenovo\Downloads\DC EV Charging Station Thailand - Piyamate Wisanuvej.kmz
โลตัส สุขุมวิท50,Lotus's Sukhumvit 50,Altervim,Altervim,"2x CCS2: 150 kW (1000V 200A), Type2: 3 kW",เลขที่ 1710 ถ.สุขุมวิท 50 แขวงพระโขนง เขตคลองเตย กทม. 10110,กทม.,13.7052451604309,100.600424005996,#icon-ci-6-labelson,C:\Users\Lenovo\Downloads\DC EV Charging Station Thailand - Piyamate Wisanuvej.kmz
โลตัส บางกะปิ,Lotus's Bangkapi,Altervim,Altervim,"2x CCS2: 150 kW (1000V 200A), Type2: 3 kW",3109 ถ. ลาดพร้าว แขวงคลองจั่น เขตบางกะปิ กรุงเทพมหานคร 10240,กรุงเทพมหานคร,13.7692901386824,100.644905448156,#icon-ci-6-labelson,C:\Users\Lenovo\Downloads\DC EV Charging Station Thailand - Piyamate Wisanuvej.kmz
โลตัส หลักสี่,Lotus's Lak Si,Altervim,Altervim,"2x CCS2: 150 kW (1000V 200A), Type2: 3 kW",เลขที่ 599 ม. 3 ถ.พหลโยธิน แขวงอนุสาวรีย์ เขตบางเขน กทม. 10220,กทม.,13.8796690276807,100.600037856192,#icon-ci-6-labelson,C:\Users\Lenovo\Downloads\DC EV Charging Station Thailand - Piyamate Wisanuvej.kmz
โลตัส ลาดพร้าว,Lotus's Ladprao,Altervim,Altervim,"2x CCS2: 150 kW (1000V 200A), Type2: 3 kW",1190 ถ. พหลโยธิน แขวงจอมพล เขตจตุจักร กรุงเทพมหานคร 10900,กรุงเทพมหานคร,13.8184317500446,100.563364195767,#icon-ci-6-labelson,C:\Users\Lenovo\Downloads\DC EV Charging Station Thailand - Piyamate Wisanuvej.kmz
