name_th,name_en,provider,network_suggested,connector_summary,address,province_th,lat,lon,style,source_url
ปตท บจก.แสงอารี  (7),PTT Sangaree Station (7),PTT,EV Station PluZ,CCS2,46 ม.18 ต.บึงคำพร้อย อ.ลำลูกกา ปทุมธานี 12150,ปทุมธานี,13.92905,100.7123,#icon-ci-1-labelson,C:\Users\Lenovo\Downloads\DC EV Charging Station Thailand - Piyamate Wisanuvej.kmz
ปตท บจ.ยูนีค พอยท์,PTT Unique Point,PTT,EV Station PluZ,CCS2,51/1 ม.2 ถ.รังสิต-นครนายก ต.ลำผักกูด อ.ธัญบุรี ปทุมธานี 12110,ปทุมธานี,14.0326053271,100.7644123525,#icon-ci-1-labelson,C:\Users\Lenovo\Downloads\DC EV Charging Station Thailand - Piyamate Wisanuvej.kmz
ปตท บจ.เอส.เค.แอล.ออยล์,PTT S.K.L. Oil,PTT,EV Station PluZ,CCS2,26/91 ม.8 ต.คลองหนึ่ง อ.คลองหลวง ปทุมธานี 12120,ปทุมธานี,14.06629,100.6246,#icon-ci-1-labelson,C:\Users\Lenovo\Downloads\DC EV Charging Station Thailand - Piyamate Wisanuvej.kmz
ปตท หจก.ดุสิตาปิโตรเลียม,PTT Dusita Petroleum,PTT,EV Station PluZ,CCS2,88 ม.6 ถ.พหลโยธิน ต.ไผ่ต่ำ อ.หนองแค สระบุรี 18140,สระบุรี,14.31902,100.8386,#icon-ci-1-labelson,C:\Users\Lenovo\Downloads\DC EV Charging Station Thailand - Piyamate Wisanuvej.kmz
ปตท บจ.ดีบี ปิโตรเลียม,PTT DB Petroleum,PTT,EV Station PluZ,CCS2,91 ม.11 ต.หนองไข่น้ำ อ.หนองแค สระบุรี 18140,สระบุรี,14.35079,100.8555,#icon-ci-1-labelson,C:\Users\Lenovo\Downloads\DC EV Charging Station Thailand - Piyamate Wisanuvej.kmz
ปตท บจ.สามปอปิโตรเลียม(สุวรรณศร),PTT Sampo Petroleum (Suwannason),PTT,EV Station PluZ,CCS2,34/3 ม.3 ต.บัวลอย อ.หนองแค สระบุรี 18140,สระบุรี,14.4098627477,100.8512067878,#icon-ci-1-labelson,C:\Users\Lenovo\Downloads\DC EV Charging Station Thailand - Piyamate Wisanuvej.kmz
ปตท บจ.ไพศาลอินเตอร์ออยล์,PTT Phaisan Inter Oil,PTT,EV Station PluZ,CCS2,59/3 ม.4 ต.ผึ้งรวง อ.เฉลิมพระเกียรติ สระบุรี 18000,สระบุรี,14.56097,100.9182,#icon-ci-1-labelson,C:\Users\Lenovo\Downloads\DC EV Charging Station Thailand - Piyamate Wisanuvej.kmz
ปตท บจ.โอเคปากช่อง,PTT OK Pak Chong,PTT,EV Station PluZ,CCS2,119 ม.7 ต.ตาลเดี่ยว อ.แก่งคอย สระบุรี 18110,สระบุรี,14.58781,100.9855,#icon-ci-1-labelson,C:\Users\Lenovo\Downloads\DC EV Charging Station Thailand - Piyamate Wisanuvej.kmz
ปตท บจ.ฟอร์ บี โลจิสติกส์,PTT For B Logistics,PTT,EV Station PluZ,CCS2,192/2 ม.9 ถ.มิตรภาพ ต.บ้านป่า อ.แก่งคอย สระบุรี 18110,สระบุรี,14.58935,101.0232,#icon-ci-1-labelson,C:\Users\Lenovo\Downloads\DC EV Charging Station Thailand - Piyamate Wisanuvej.kmz
ปตท บจ.วี ที กรุ๊ป (2013) (1),PTT V.T. Group (2013) (1),PTT,EV Station PluZ,CCS2,88 ม.9 ถ.พหลโยธิน  ต.พุคำจาน อ.พระพุทธบาท สระบุรี 18120,สระบุรี,14.712741,100.826383,#icon-ci-1-labelson,C:\Users\Lenovo\Downloads\DC EV Charging Station Thailand - Piyamate Wisanuvej.kmz
ปตท บจ.ศ.มหาโภคาการปิโตรเลียม,PTT Mahapoka Petroleum,PTT,EV Station PluZ,CCS2,40/1 ม.6 ต.ขยาย อ.บางปะหัน พระนครศรีอยุธยา 13220,พระนครศรีอยุธยา,14.42468,100.5616,#icon-ci-1-labelson,C:\Users\Lenovo\Downloads\DC EV Charging Station Thailand - Piyamate Wisanuvej.kmz
ปตท หจก.คงทองปิโตรเลียม,PTT Kongthong Petroleum,PTT,EV Station PluZ,CCS2,115/1 ม.6 ถ.มาลัยแมน ต.จรเข้สามพัน อ.อู่ทอง สุพรรณบุรี 72160,สุพรรณบุรี,14.3381,99.86601,#icon-ci-1-labelson,C:\Users\Lenovo\Downloads\DC EV Charging Station Thailand - Piyamate Wisanuvej.kmz
ปตท บจ.สุพรรณธนแก๊ส,PTT Suphanthan Gas,PTT,EV Station PluZ,CCS2,9/1 ม.2 ต.เขาพระ อ.เดิมบางนางบวช สุพรรณบุรี 72120,สุพรรณบุรี,14.85759,100.093,#icon-ci-1-labelson,C:\Users\Lenovo\Downloads\DC EV Charging Station Thailand - Piyamate Wisanuvej.kmz
ปตท อาร์เอ็ม วิภาวดี เซียร์ กม.27 (ขาออก),PTT RM Bangkok-Vibhavadi Zeer Km.27,PTT,EV Station PluZ,CCS2,28/8 ม.9 แขวงสีกัน เขตดอนเมือง กรุงเทพมหานคร 10210,กรุงเทพมหานคร,13.95119,100.6182,#icon-ci-1-labelson,C:\Users\Lenovo\Downloads\DC EV Charging Station Thailand - Piyamate Wisanuvej.kmz
ปตท อาร์เอ็ม หินกอง,PTT RM Hin Kong,PTT,EV Station PluZ,CCS2,9 ม.4 ต.ห้วยทราย อ.หนองแค สระบุรี 18230,สระบุรี,14.441265,100.8985,#icon-ci-1-labelson,C:\Users\Lenovo\Downloads\DC EV Charging Station Thailand - Piyamate Wisanuvej.kmz
ปตท บจ.นิยมสำราญปิโตรเลียม,PTT Niyomsamran Petroleum,PTT,EV Station PluZ,CCS2,224 ม.6 ต.ดีลัง อ.พัฒนานิคม ลพบุรี 15220,ลพบุรี,14.836472,100.910028,#icon-ci-1-labelson,C:\Users\Lenovo\Downloads\DC EV Charging Station Thailand - Piyamate Wisanuvej.kmz
ปตท หจก.ลานทอง มุกดาหาร,PTT Lan Thong Mukdahan,PTT,EV Station PluZ,CCS2,555 ม.7 ต.บางทรายใหญ่ อ.เมืองมุกดาหาร มุกดาหาร 49000,มุกดาหาร,16.5885134432,104.7195179996,#icon-ci-1-labelson,C:\Users\Lenovo\Downloads\DC EV Charging Station Thailand - Piyamate Wisanuvej.kmz
ปตท หจก.วิชิตนาคปิโตรเลียม,PTT Wichitnak Petroleum,PTT,EV Station PluZ,CCS2,612 ถ.พหลโยธิน ต.ตาคลี อ.ตาคลี นครสวรรค์ 60140,นครสวรรค์,15.26322267,100.33444765,#icon-ci-1-labelson,C:\Users\Lenovo\Downloads\DC EV Charging Station Thailand - Piyamate Wisanuvej.kmz
ปตท อาร์เอ็ม อินทร์บุรี กม.104 (ขาเข้า),PTT RM Inburi Km. 104 (IB),PTT,EV Station PluZ,CCS2,111 ม.2 ต.ท่างาม อ.อินทร์บุรี สิงห์บุรี 16110,สิงห์บุรี,15.0241,100.33884,#icon-ci-1-labelson,C:\Users\Lenovo\Downloads\DC EV Charging Station Thailand - Piyamate Wisanuvej.kmz
ปตท อาร์เอ็ม เอเซีย ไฮเวย์ กม.90 (ขาออก),PTT RM Asia Highway KM.90 (OB),PTT,EV Station PluZ,CCS2,68 ม.3 ต.บางมัญ อ.เมืองสิงห์บุรี สิงห์บุรี 16000,สิงห์บุรี,14.916216,100.402143,#icon-ci-1-labelson,C:\Users\Lenovo\Downloads\DC EV Charging Station Thailand - Piyamate Wisanuvej.kmz
โรงพยาบาลพญาไท 1,"Phyathai 1 Hospital (Parking Building, 3rd Floor)",PTT,EV Station PluZ,CCS2,364/1 ถ.ศรีอยุธยา  แขวงถนนพญาไท เขตราชเทวี กรุงเทพมหานคร 10400,กรุงเทพมหานคร,13.7561,100.5394,#icon-ci-1-labelson,C:\Users\Lenovo\Downloads\DC EV Charging Station Thailand - Piyamate Wisanuvej.kmz
โรงพยาบาลพญาไท 2,"Phyathai 2 Hospital (Parking Building, 2B Floor)",PTT,EV Station PluZ,CCS2,943 ถ.พหลโยธิน แขวงสามเสนใน เขตพญาไท กรุงเทพมหานคร 10400,กรุงเทพมหานคร,13.7704750251,100.5409003582,#icon-ci-1-labelson,C:\Users\Lenovo\Downloads\DC EV Charging Station Thailand - Piyamate Wisanuvej.kmz
โรงพยาบาลพญาไท 3 (อาคารจอดรถ ชั้นใต้ดิน),Phyathai 3 Hospital (Underground Parking lot),PTT,EV Station PluZ,CCS2,111 ถ.เพชรเกษม  แขวงปากคลองภาษีเจริญ เขตภาษีเจริญ กรุงเทพมหานคร 10160,กรุงเทพมหานคร,13.72321,100.4646,#icon-ci-1-labelson,C:\Users\Lenovo\Downloads\DC EV Charging Station Thailand - Piyamate Wisanuvej.kmz
โรงพยาบาลปิยะเวท,Piyavate Hospital,PTT,EV Station PluZ,"CCS2, Type 2",998 ถ.ริมคลองสามเสน  แขวงบางกะปิ เขตห้วยขวาง กรุงเทพมหานคร 10310,กรุงเทพมหานคร,13.75356,100.5802,#icon-ci-1-labelson,C:\Users\Lenovo\Downloads\DC EV Charging Station Thailand - Piyamate Wisanuvej.kmz
ปตท บจ.โชคสุขุม,PTT Choksukhum,PTT,EV Station PluZ,"CCS2, Type 2",42/2 ถ.เพชรเกษม ต.หัวหิน อ.หัวหิน ประจวบคีรีขันธ์ 77110,ประจวบคีรีขันธ์,12.61649,99.95,#icon-ci-1-labelson,C:\Users\Lenovo\Downloads\DC EV Charging Station Thailand - Piyamate Wisanuvej.kmz
แฟชั่นไอส์แลนด์ เอ (ชั้น 2),Fashion Island A (2nd Floor),PTT,EV Station PluZ,"CCS2, Type 2","587,589, 589/7-9 ถ.รามอินทรา แขวงคันนายาว เขตคันนายาว กรุงเทพมหานคร 10230",กรุงเทพมหานคร,13.8267452,100.6793637,#icon-ci-1-labelson,C:\Users\Lenovo\Downloads\DC EV Charging Station Thailand - Piyamate Wisanuvej.kmz
บิ๊กซี บางปะกอก,BigC Bangpakok,PTT,EV Station PluZ,CCS2,278 ม.1 ถ.สุขสวัสดิ์ แขวงบางปะกอก เขตราษฎร์บูรณะ กรุงเทพมหานคร 10140,กรุงเทพมหานคร,13.6830710779,100.492604703,#icon-ci-1-labelson,C:\Users\Lenovo\Downloads\DC EV Charging Station Thailand - Piyamate Wisanuvej.kmz
ปตท บจ.เพชรพระเทพปิโตรเลียม,PTT Petch Pratep Petroleum,PTT,EV Station PluZ,CCS2,511 ถ.พรานนก-พุทธมณฑลสาย 4 แขวงบางพรม เขตตลิ่งชัน กรุงเทพมหานคร 10170,กรุงเทพมหานคร,13.751,100.4419,#icon-ci-1-labelson,C:\Users\Lenovo\Downloads\DC EV Charging Station Thailand - Piyamate Wisanuvej.kmz
ปตท บจ.ปิโตรเลียมอเวนิว แจ้งวัฒนะ,PTT Petroleum Avenue Chang Watthana,PTT,EV Station PluZ,"CCS2, Type 2",99/114 ถ.แจ้งวัฒนะ แขวงทุ่งสองห้อง เขตหลักสี่ กรุงเทพมหานคร 10210,กรุงเทพมหานคร,13.8892,100.573,#icon-ci-1-labelson,C:\Users\Lenovo\Downloads\DC EV Charging Station Thailand - Piyamate Wisanuvej.kmz
ปตท บจ.สยามเออเบินพัฒนา,PTT Siam Urban Pattana,PTT,EV Station PluZ,CCS2,41/66 ม.5 ถ.เชื่อมสัมพันธ์  แขวงโคกแฝด เขตหนองจอก กรุงเทพมหานคร 10530,กรุงเทพมหานคร,13.827181,100.847605,#icon-ci-1-labelson,C:\Users\Lenovo\Downloads\DC EV Charging Station Thailand - Piyamate Wisanuvej.kmz
สยามปทุมวัน เฮ้าส์,Siam Pathumwan House,PTT,EV Station PluZ,"CCS2, Type 2",891/1 ถ.พระราม 1 แขวงวังใหม่ เขตปทุมวัน กรุงเทพมหานคร 10330,กรุงเทพมหานคร,13.74763,100.5304,#icon-ci-1-labelson,C:\Users\Lenovo\Downloads\DC EV Charging Station Thailand - Piyamate Wisanuvej.kmz
ปตท หจก.อุดมชัยวิทย์,PTT Udomchaiwit,PTT,EV Station PluZ,CCS2,31/2 ม.2 ถ.เพชรเกษม กม.ที่ 32/5 ต.ยายชา อ.สามพราน นครปฐม 73110,นครปฐม,13.73763,100.2423,#icon-ci-1-labelson,C:\Users\Lenovo\Downloads\DC EV Charging Station Thailand - Piyamate Wisanuvej.kmz
ปตท บจ.เคซีเอฟ ปิโตร,PTT KCF Petro,PTT,EV Station PluZ,CCS2,105 ม.3 ต.ลำลูกบัว อ.ดอนตูม นครปฐม 73150,นครปฐม,14.03869,100.0939,#icon-ci-1-labelson,C:\Users\Lenovo\Downloads\DC EV Charging Station Thailand - Piyamate Wisanuvej.kmz
ปตท บจ.เอ็ม.เอส.แอล.เอ็นเนอร์จี,PTT MSL Energy,PTT,EV Station PluZ,CCS2,147/3 ม.8 ต.ลำภู อ.เมืองนราธิวาส นราธิวาส 96000,นราธิวาส,6.408246,101.7954,#icon-ci-1-labelson,C:\Users\Lenovo\Downloads\DC EV Charging Station Thailand - Piyamate Wisanuvej.kmz
ปตท อิสรีย์รุ่งเรืองบริการ,PTT Isaree Rungruang Service,PTT,EV Station PluZ,CCS2,111 ม.6 ต.บางโทรัด อ.เมืองสมุทรสาคร สมุทรสาคร 74000,สมุทรสาคร,13.5136,100.1533,#icon-ci-1-labelson,C:\Users\Lenovo\Downloads\DC EV Charging Station Thailand - Piyamate Wisanuvej.kmz
ปตท หจก.ราชวีระกิจ,PTT Rajweerakit,PTT,EV Station PluZ,CCS2,44 ม.3 ถ.เขาวัง-น้ำพุ ต.น้ำพุ อ.เมืองราชบุรี ราชบุรี 70000,ราชบุรี,13.51211,99.65643,#icon-ci-1-labelson,C:\Users\Lenovo\Downloads\DC EV Charging Station Thailand - Piyamate Wisanuvej.kmz
ปตท บจ.ส.สาครเอ็นเนอร์ยี่,PTT S. Sakorn Energy,PTT,EV Station PluZ,CCS2,94/315 ม.7 ต.ท่าทราย อ.เมืองสมุทรสาคร สมุทรสาคร 74000,สมุทรสาคร,13.56342,100.2717,#icon-ci-1-labelson,C:\Users\Lenovo\Downloads\DC EV Charging Station Thailand - Piyamate Wisanuvej.kmz
ปตท บจ.พาวเวอร์ ปิโตรเลียม,PTT Power Petroleum,PTT,EV Station PluZ,CCS2,99 ม.3 ต.บางน้ำจืด อ.เมืองสมุทรสาคร สมุทรสาคร 74000,สมุทรสาคร,13.62662,100.3568,#icon-ci-1-labelson,C:\Users\Lenovo\Downloads\DC EV Charging Station Thailand - Piyamate Wisanuvej.kmz
ปตท หจก.ป.ศรีมโหสถ,PTT P. Sri Mahosot,PTT,EV Station PluZ,CCS2,314 ม.6 ต.โคกปีบ อ.ศรีมโหสถ ปราจีนบุรี 25190,ปราจีนบุรี,13.87345,101.4148,#icon-ci-1-labelson,C:\Users\Lenovo\Downloads\DC EV Charging Station Thailand - Piyamate Wisanuvej.kmz
ปตท บจ.ทักษิณออยล์,PTT Thaksin Oil,PTT,EV Station PluZ,CCS2,82 ม.3 ถ.สายเอเซีย ต.คลองไทร อ.ท่าฉาง สุราษฎร์ธานี 84150,สุราษฎร์ธานี,9.18733,99.139191,#icon-ci-1-labelson,C:\Users\Lenovo\Downloads\DC EV Charging Station Thailand - Piyamate Wisanuvej.kmz
ปตท บจ.สยาม โทเทิล เอ็นเนอร์จี้,PTT Siam Total Energy,PTT,EV Station PluZ,CCS2,38/12 ม.1 ต.บางน้ำจืด อ.เมืองสมุทรสาคร สมุทรสาคร 74000,สมุทรสาคร,13.59349,100.362,#icon-ci-1-labelson,C:\Users\Lenovo\Downloads\DC EV Charging Station Thailand - Piyamate Wisanuvej.kmz
ปตท อาร์เอ็ม 05011 เขาหินซ้อน (ขาเข้า),PTT RM Khao Hin Son (IB),PTT,EV Station PluZ,CCS2,871 ม.2 ต.เขาหินซ้อน อ.พนมสารคาม ฉะเชิงเทรา 24120,ฉะเชิงเทรา,13.771384,101.522764,#icon-ci-1-labelson,C:\Users\Lenovo\Downloads\DC EV Charging Station Thailand - Piyamate Wisanuvej.kmz
ปตท อาร์เอ็ม 05010 เขาหินซ้อน (ขาออก),PTT RM Khao Hin Son (OB),PTT,EV Station PluZ,CCS2,55 ม.10 ต.เขาหินซ้อน อ.พนมสารคาม ฉะเชิงเทรา 24120,ฉะเชิงเทรา,13.751783,101.495514,#icon-ci-1-labelson,C:\Users\Lenovo\Downloads\DC EV Charging Station Thailand - Piyamate Wisanuvej.kmz
ปตท หจก.ช้างแก้วปิโตรเลียม,PTT Chang Kaew Petroleum,PTT,EV Station PluZ,CCS2,46/2 ม.2 ถ.กาญจนวณิชย์ ต.เขารูปช้าง อ.เมืองสงขลา สงขลา 90000,สงขลา,7.15244,100.6001,#icon-ci-1-labelson,C:\Users\Lenovo\Downloads\DC EV Charging Station Thailand - Piyamate Wisanuvej.kmz
ปตท หจก.ศิริพรหมเจริญ ปิโตรเลียม,PTT Siri Phrom Charoen Petroleum,PTT,EV Station PluZ,CCS2,66/3 ม.3 ต.ปริก อ.ทุ่งใหญ่ นครศรีธรรมราช 80240,นครศรีธรรมราช,8.314936,99.47084,#icon-ci-1-labelson,C:\Users\Lenovo\Downloads\DC EV Charging Station Thailand - Piyamate Wisanuvej.kmz
ปตท บจ.ศิรินครประตูลอด,PTT Sirinakorn Pratu Lod,PTT,EV Station PluZ,CCS2,999 ถ.พัฒนาการคูขวาง  ต.ในเมือง อ.เมืองนครศรีธรรมราช นครศรีธรรมราช 80000,นครศรีธรรมราช,8.423799,99.97331,#icon-ci-1-labelson,C:\Users\Lenovo\Downloads\DC EV Charging Station Thailand - Piyamate Wisanuvej.kmz
ปตท หจก.เอกธาราออยล์,PTT Ektara Oil,PTT,EV Station PluZ,CCS2,39/13 ม.2 ต.ทรายขาว อ.คลองท่อม กระบี่ 81170,กระบี่,7.750656,99.256687,#icon-ci-1-labelson,C:\Users\Lenovo\Downloads\DC EV Charging Station Thailand - Piyamate Wisanuvej.kmz
ปตท หจก.ภูฆัง,PTT Phukhang Station,PTT,EV Station PluZ,CCS2,57 ม.6 ต.บางรักพัฒนา อ.บางบัวทอง นนทบุรี 11110,นนทบุรี,13.90929,100.3925,#icon-ci-1-labelson,C:\Users\Lenovo\Downloads\DC EV Charging Station Thailand - Piyamate Wisanuvej.kmz
ปตท หจก.ส.โชคสันติ,PTT S. Choksanti,PTT,EV Station PluZ,CCS2,99 ม.2 ถ.เพชรเกษม ต.ห้วยโรง อ.เขาย้อย เพชรบุรี 76140,เพชรบุรี,13.32727,99.82947,#icon-ci-1-labelson,C:\Users\Lenovo\Downloads\DC EV Charging Station Thailand - Piyamate Wisanuvej.kmz
ปตท บจ.กรีน ออโต้ กรุ๊ป,PTT Green Auto Group,PTT,EV Station PluZ,CCS2,200/9 ม.3 ถ.บางกรวย-ไทรน้อย ต.บางรักพัฒนา อ.บางบัวทอง นนทบุรี 11110,นนทบุรี,13.885723,100.433479,#icon-ci-1-labelson,C:\Users\Lenovo\Downloads\DC EV Charging Station Thailand - Piyamate Wisanuvej.kmz
ปตท บจ.พระราม 2 พัฒนาปิโตรเลียม,PTT Rama 2 Pattanapetroleum,PTT,EV Station PluZ,CCS2,88/8 ม.2 ถ.พระราม 2 (กม.52 +100) ต.นาโคก อ.เมืองสมุทรสาคร สมุทรสาคร 74000,สมุทรสาคร,13.45657,100.089,#icon-ci-1-labelson,C:\Users\Lenovo\Downloads\DC EV Charging Station Thailand - Piyamate Wisanuvej.kmz
ปตท บจ.หลังสวนปิยะแก๊ส  (8),PTT Lang Suan Piya Gas (8),PTT,EV Station PluZ,CCS2,"97/4,97/5,97/6,97/7,97/8  ม.2 ต.บางหมาก อ.เมืองชุมพร ชุมพร 86000",ชุมพร,10.48228,99.20108,#icon-ci-1-labelson,C:\Users\Lenovo\Downloads\DC EV Charging Station Thailand - Piyamate Wisanuvej.kmz
ปตท บจ.บีทีซี (พุทธสาคร) (1),PTT BTC (Phutthasakhon) (1),PTT,EV Station PluZ,CCS2,188/8 ม.6 ต.สวนหลวง อ.กระทุ่มแบน สมุทรสาคร 74110,สมุทรสาคร,13.67724,100.3202,#icon-ci-1-labelson,C:\Users\Lenovo\Downloads\DC EV Charging Station Thailand - Piyamate Wisanuvej.kmz
ปตท บจ.เพชรธน กรุ๊ป,PTT Petchtana Group,PTT,EV Station PluZ,CCS2,59/11 ม.8 ต.ท่าทราย อ.เมืองสมุทรสาคร สมุทรสาคร 74000,สมุทรสาคร,13.56627,100.2827,#icon-ci-1-labelson,C:\Users\Lenovo\Downloads\DC EV Charging Station Thailand - Piyamate Wisanuvej.kmz
ปตท หลังสวน,PTT Lang Suan Branch,PTT,EV Station PluZ,CCS2,122 ม.4 ถ.เพชรเกษม ต.วังตะกอ อ.หลังสวน ชุมพร 86110,ชุมพร,9.982793,99.06836,#icon-ci-1-labelson,C:\Users\Lenovo\Downloads\DC EV Charging Station Thailand - Piyamate Wisanuvej.kmz
ปตท บจ.ชารี,PTT Chari,PTT,EV Station PluZ,CCS2,99/9 ม.2 ต.ละหาร อ.บางบัวทอง นนทบุรี 11110,นนทบุรี,13.92542,100.4354,#icon-ci-1-labelson,C:\Users\Lenovo\Downloads\DC EV Charging Station Thailand - Piyamate Wisanuvej.kmz
ปตท บจ.เค.พี.เอฟ.กรุ๊ป,PTT K.P.F. Group,PTT,EV Station PluZ,CCS2,59 ม.5 ถ.เอเซีย ต.ขันเงิน อ.หลังสวน ชุมพร 86110,ชุมพร,9.920271,99.06053,#icon-ci-1-labelson,C:\Users\Lenovo\Downloads\DC EV Charging Station Thailand - Piyamate Wisanuvej.kmz
ปตท บจ.ชุมพรประตูเมือง,PTT Chumphon Pratu Mueang,PTT,EV Station PluZ,CCS2,135/1 ม.10 ต.หาดพันไกร อ.เมืองชุมพร ชุมพร 86000,ชุมพร,10.56944,99.11603,#icon-ci-1-labelson,C:\Users\Lenovo\Downloads\DC EV Charging Station Thailand - Piyamate Wisanuvej.kmz
ปตท บจ.ฟ้า-ภิญโญปิโตรเลียม,PTT Fah-Phinyo Petroleum,PTT,EV Station PluZ,CCS2,299 ม.8 ต.ท่าข้าม อ.ท่าแซะ ชุมพร 86140,ชุมพร,10.56196,99.1154,#icon-ci-1-labelson,C:\Users\Lenovo\Downloads\DC EV Charging Station Thailand - Piyamate Wisanuvej.kmz
ปตท บจ.ไพศาลพลังไทย,PTT Phaisan Phalang Thai,PTT,EV Station PluZ,CCS2,15/6 ม.6 ต.คลองพระอุดม อ.ปากเกร็ด นนทบุรี 11120,นนทบุรี,13.92357,100.4754,#icon-ci-1-labelson,C:\Users\Lenovo\Downloads\DC EV Charging Station Thailand - Piyamate Wisanuvej.kmz
ปตท บจ.โชคมหาชัย (1),PTT Chok Mahachai (1),PTT,EV Station PluZ,CCS2,24/498 ม.3 ต.บางหญ้าแพรก อ.เมืองสมุทรสาคร สมุทรสาคร 74000,สมุทรสาคร,13.52975,100.2924,#icon-ci-1-labelson,C:\Users\Lenovo\Downloads\DC EV Charging Station Thailand - Piyamate Wisanuvej.kmz
ปตท บจ.พีเคเค เอนเนอร์ยี่,PTT PKK Energy,PTT,EV Station PluZ,CCS2,99/88 ม.12 ต.หลักสาม อ.บ้านแพ้ว สมุทรสาคร 74120,สมุทรสาคร,13.57205,100.1137,#icon-ci-1-labelson,C:\Users\Lenovo\Downloads\DC EV Charging Station Thailand - Piyamate Wisanuvej.kmz
ปตท บจ.เกื้อกูลปิโตรเลียม,PTT Kuakul Petroleum,PTT,EV Station PluZ,CCS2,615 ม.17 ต.เหนือเมือง อ.เมืองร้อยเอ็ด ร้อยเอ็ด 45000,ร้อยเอ็ด,16.071417,103.652483,#icon-ci-1-labelson,C:\Users\Lenovo\Downloads\DC EV Charging Station Thailand - Piyamate Wisanuvej.kmz
ปตท บจ.มานะชัย รุ่งเรือง,PTT Manachai Rungruang,PTT,EV Station PluZ,CCS2,17/4 ม.8 ถ.เศรษฐกิจ ต.คลองมะเดื่อ อ.กระทุ่มแบน สมุทรสาคร 74110,สมุทรสาคร,13.6308,100.2947,#icon-ci-1-labelson,C:\Users\Lenovo\Downloads\DC EV Charging Station Thailand - Piyamate Wisanuvej.kmz
ปตท บจ.มานะชัย มั่นคง,PTT Manachai Munkong,PTT,EV Station PluZ,CCS2,1/11 ม.3 ต.ชัยมงคล อ.เมืองสมุทรสาคร สมุทรสาคร 74000,สมุทรสาคร,13.541864,100.167071,#icon-ci-1-labelson,C:\Users\Lenovo\Downloads\DC EV Charging Station Thailand - Piyamate Wisanuvej.kmz
ปตท บจ.พระราม2 เทรดดิ้ง,PTT Rama 2 Trading,PTT,EV Station PluZ,CCS2,128 ม.7 ต.สามเรือน อ.เมืองราชบุรี ราชบุรี 70000,ราชบุรี,13.61608,99.8401,#icon-ci-1-labelson,C:\Users\Lenovo\Downloads\DC EV Charging Station Thailand - Piyamate Wisanuvej.kmz
